{
  "id": "find-the-edge",
  "sport": "soccer",
  "version": "1.0.0-experimental",
  "approvedMarkets": [
    "moneyline",
    "btts",
    "goal_total",
    "team_total",
    "anytime_scorer",
    "shots_on_target",
    "spread"
  ],
  "prohibitedMarkets": [],
  "minimumEv": 0.025,
  "minimumComparisonBooks": 3,
  "maximumPriceAgeMinutes": 15
}
